{
  "schema": "jam2-debug-scenario",
  "run_id": "music-generation-reggae-corpus",
  "operation": "validate.music-full-form-corpus",
  "profile": "fast",
  "artifacts": {
    "root": "../../artifacts/music-research/reggae-iteration-8"
  },
  "corpus": {
    "render_audio": false,
    "matched_complexity_seeds": true,
    "samples_per_cell": 12,
    "style_id": "reggae"
  }
}
