{
  "schema": "jam2-debug-scenario",
  "run_id": "local-headless-smoke",
  "operation": "local",
  "profile": "fast",
  "runtime": {
    "headless_audio": true,
    "audio_buffer_size": 256,
    "sample_rate": 48000,
    "stream_ms": 1000,
    "stats": true,
    "stats_interval_ms": 250
  },
  "artifacts": {"root": "../diagnostic_logs/manual/local-headless-smoke"}
}
