{
  "schema": "jam2-debug-scenario",
  "run_id": "lifecycle-headless-smoke",
  "operation": "lifecycle.local-network-local",
  "profile": "fast",
  "runtime": {
    "headless_audio": true,
    "audio_buffer_size": 256,
    "sample_rate": 48000,
    "stats": true,
    "stats_interval_ms": 250,
    "os_priority": "realtime"
  },
  "artifacts": {"root": "../diagnostic_logs/manual/lifecycle-headless-smoke"}
}
